<!DOCTYPE CUSTOMER_DETAILS [
<!ELEMENT CUSTOMER_DETAILS (CUSTOMER*)>
<!ELEMENT CUSTOMER (ID, NAME, EMAIL, PHONE, ADDRESS)>
<!ELEMENT ID (#PCDATA)>
<!ELEMENT NAME (#PCDATA)>
<!ELEMENT EMAIL (#PCDATA)>
<!ELEMENT PHONE (#PCDATA)>
<!ELEMENT ADDRESS (STREET, CITY, STATE, ZIP)>
<!ELEMENT STREET (#PCDATA)>
<!ELEMENT CITY (#PCDATA)>
<!ELEMENT STATE (#PCDATA)>
<!ELEMENT ZIP (#PCDATA)>
<!ATTLIST CUSTOMER id ID #REQUIRED>
]>
<CUSTOMER_DETAILS>
<CUSTOMER id="c001">
<ID>C001</ID>
<NAME>John Doe</NAME>
<EMAIL>johndoe@example.com</EMAIL>
<PHONE>123-456-7890</PHONE>
<ADDRESS>
<STREET>123 Main St</STREET>
<CITY>Anytown</CITY>
<STATE>CA</STATE>
<ZIP>12345</ZIP>
</ADDRESS>
</CUSTOMER>
<CUSTOMER id="c002">
<ID>C002</ID>
<NAME>Jane Smith</NAME>
<EMAIL>janesmith@example.com</EMAIL>
<PHONE>098-765-4321</PHONE>
<ADDRESS>
<STREET>456 Elm St</STREET>
<CITY>Othertown</CITY>
<STATE>TX</STATE>
<ZIP>67890</ZIP>
</ADDRESS>
</CUSTOMER>
</CUSTOMER_DETAILS>